{
  "$schema": "https://json-schema.org/draft/2020-12/schema",
  "$id": "https://clusterlm.invalid/schemas/backend-descriptor-v1.schema.json",
  "title": "ClusterLM backend capability descriptor, contract v1 (ADR 0401)",
  "type": "object",
  "required": ["schema", "contract_version", "id", "display_name", "factory_name", "model_support", "devices", "execution", "state", "speculation", "limitations", "qualification"],
  "additionalProperties": false,
  "properties": {
    "schema": { "const": "clusterlm.backend-descriptor" },
    "contract_version": { "const": 1 },
    "id": { "enum": ["llama-local", "strata-hybrid", "reference"] },
    "display_name": { "type": "string", "maxLength": 80 },
    "factory_name": { "enum": ["llama", "strata", "reference"], "description": "Name accepted by backends::make_backend (backend_factory.hpp)." },
    "role_in_product": { "enum": ["production", "development-only"], "default": "production" },
    "model_support": {
      "type": "object",
      "required": ["tensor_formats", "families", "unlisted_family_status"],
      "additionalProperties": false,
      "properties": {
        "containers": { "type": "array", "items": { "enum": ["gguf", "gguf-split", "manifest-native"] } },
        "tensor_formats": { "type": "array", "items": { "type": "string", "maxLength": 32 }, "description": "Quantization/tensor type names the backend can execute (GGUF type names). A model with a tensor type not listed here is rejected before provisioning." },
        "families": {
          "type": "array",
          "items": {
            "type": "object", "required": ["family_match", "status"], "additionalProperties": false,
            "properties": {
              "family_match": { "type": "string", "maxLength": 120, "description": "Exact family id or a glob over the library's family field." },
              "architecture": { "type": "string", "maxLength": 64 },
              "status": { "$ref": "#/$defs/label" },
              "evidence": { "type": "array", "items": { "type": "string", "maxLength": 120 }, "description": "CI job / test names / HQ ids that justify the label." }
            }
          }
        },
        "unlisted_family_status": { "$ref": "#/$defs/label", "description": "Status for a model whose family is not listed. 'Experimental' means: parses and a Host-only load is attempted on explicit user opt-in; it is never offered as distributable." }
      }
    },
    "devices": {
      "type": "object", "required": ["cpu", "gpu_vendors"], "additionalProperties": false,
      "properties": {
        "cpu": { "type": "boolean" },
        "gpu_vendors": { "type": "array", "items": { "enum": ["nvidia", "amd", "intel"] } },
        "min_compute_capability": { "type": "string", "pattern": "^[0-9]+\\.[0-9]+$" },
        "requires_runtime": { "type": "array", "items": { "type": "string", "maxLength": 64 }, "description": "e.g. 'cuda>=12.0'. Detected at runtime; absent => backend not offered (never advertised)." }
      }
    },
    "execution": {
      "type": "object",
      "required": ["single_host", "cross_machine", "validated_max_workers", "layer_partitioning", "cpu_gpu_hybrid", "token_free_middle_stages", "manual_layer_ranges", "worker_roles"],
      "additionalProperties": false,
      "properties": {
        "single_host": { "type": "boolean" },
        "cross_machine": { "type": "boolean" },
        "validated_max_workers": { "type": "integer", "minimum": 0, "description": "Largest Worker count that has an automated test (real or fixture) behind it. Profile validation rejects max_workers above this. Raising it needs evidence recorded in `evidence`." },
        "validated_topologies": { "type": "array", "items": { "type": "string", "maxLength": 120 }, "description": "Human-readable shapes covered by tests, e.g. 'host-prefix → worker → worker → host-tail'." },
        "layer_partitioning": { "enum": ["none", "contiguous-layers"] },
        "cpu_gpu_hybrid": { "type": "boolean", "description": "Weights/experts split across CPU RAM and GPU VRAM within one machine." },
        "token_free_middle_stages": { "type": "boolean" },
        "manual_layer_ranges": { "type": "boolean" },
        "worker_roles": { "type": "array", "items": { "enum": ["middle"] }, "description": "Stage roles a Worker may play. Prefix and tail are always Host (ExecutionDomain contract)." },
        "evidence": { "type": "array", "items": { "type": "string", "maxLength": 120 } }
      }
    },
    "state": {
      "type": "object", "required": ["kinds", "supports_rollback"], "additionalProperties": false,
      "properties": {
        "kinds": { "type": "array", "items": { "enum": ["kv", "recurrent", "indexer", "ple-history"] } },
        "supports_rollback": { "enum": ["native", "recompute", "none"], "description": "How an aborted/partially accepted speculative window is undone (llama.cpp recurrent state without seq_rm falls back to recompute)." },
        "max_sessions_per_domain": { "type": "integer", "minimum": 1 },
        "per_client_isolation": { "type": "boolean", "description": "True when a session's state can be held and released independently of other sessions on the same domain." }
      }
    },
    "speculation": {
      "type": "object", "required": ["window_commit_abort", "mtp"], "additionalProperties": false,
      "properties": {
        "window_commit_abort": { "type": "boolean" },
        "mtp": { "enum": ["none", "one-hot-proposals", "full-distribution"] },
        "max_q": { "type": "integer", "minimum": 1 }
      }
    },
    "serving": {
      "type": "object", "additionalProperties": false,
      "description": "What the serving layer may rely on. Tool calling itself is a property of the model's chat template + parser, not of the backend; these are the backend-side prerequisites.",
      "properties": {
        "full_logits_for_sampling": { "type": "boolean" },
        "constrained_decoding": { "type": "boolean", "description": "Grammar/JSON-schema constrained sampling available. If false, `response_format` json_schema requests are refused rather than emulated." },
        "logprobs": { "type": "boolean" }
      }
    },
    "limitations": { "type": "array", "items": { "type": "string", "maxLength": 300 } },
    "options_schema": { "type": "object", "description": "JSON Schema for profile.backend.options." },
    "qualification": {
      "type": "object", "required": ["label"], "additionalProperties": false,
      "properties": {
        "label": { "$ref": "#/$defs/label" },
        "hardware_experiments": { "type": "array", "items": { "type": "string", "pattern": "^HQ-[A-Z0-9]+-[0-9]+$" }, "description": "Ids in HARDWARE-QUALIFICATION.md that must pass to move the label to 'Supported and qualified'." },
        "notes": { "type": "string", "maxLength": 500 }
      }
    }
  },
  "$defs": {
    "label": { "enum": ["Supported and qualified", "Supported, awaiting hardware qualification", "Experimental", "Unsupported"] }
  }
}
